"text","category"
"stock prices of rolls royce","qa_stock"
"stock market","qa_stock"
"how effective will be to buy nike stock","qa_stock"
"is i. b. m. up today","qa_stock"
"open stock price for name","qa_stock"
"show me share price of amazon","qa_stock"
"what is amazon worth","qa_stock"
"what is planned for today in my local area","recommendation_events"
"are there any interesting events around this area","recommendation_events"
"today's local events","recommendation_events"
"is there a food festival in the area","recommendation_events"
"what's around tonight","recommendation_events"
"any activity in the area","recommendation_events"
"what's the next event at the library","recommendation_events"
"where is the event venue","recommendation_events"
"whats happening around my town","recommendation_events"
"local show","recommendation_events"
"what is a good place for cruise","recommendation_locations"
"best restaurant in local area","recommendation_locations"
"where is the nearest italian restaurant","recommendation_locations"
"give me the name of all the shops in my area","recommendation_locations"
"can you tell me a good place to eat","recommendation_locations"
"where can i get shawarma in this area","recommendation_locations"
"where is a good wine bar near me","recommendation_locations"
"where to buy cannon cameras","recommendation_locations"
"where is the nearest pub in the city","recommendation_locations"
"search for local shops","recommendation_locations"
"is logan a good movie to watch","recommendation_movies"
"can you recommend some movies to watch in theater near me","recommendation_movies"
"recommend a movie playing in me area","recommendation_movies"
"what are the current movies playing in me area","recommendation_movies"
"movies with good reviews","recommendation_movies"
"what's playing at brea plaza five","recommendation_movies"
"latest movie releases","recommendation_movies"
"local theater screening which movie","recommendation_movies"
"recommend a movie with justin bieber","recommendation_movies"
"what are the show times of logan","recommendation_movies"
"i would like to make a post on times twitter","social_post"
"tweet complaint to amazon products","social_post"
"please tweet the following complaint","social_post"
"what is the customer service feedback","social_post"
"tweet insight cable's customer service and tell them i have been waiting on hold for thirty minutes","social_post"
"post to facebook I'm home","social_post"
"it would be nice if you post status for me","social_post"
"write a tweet to this company","social_post"
"tweet consumer service that the goods are of low quality","social_post"
"write this complaint to comcasts customer service twitter","social_post"
"show me my social media notifications","social_query"
"my facebook update in every three hour should be available","social_query"
"have i got new content in my twitter feed","social_query"
"did renee just post to my facebook feed","social_query"
"did mark post anything new on facebook","social_query"
"who has written to me or mentioned me in social media","social_query"
"is there any post from my friend mike in facebook","social_query"
"how many likes i have got on my eggless cake post on youtube","social_query"
"do i have new likes","social_query"
"check my twitter notification","social_query"
"schedule a delivery from food at the nearby takeaway diner","takeaway_order"
"call eastwind and order lomaine to go","takeaway_order"
"i'm hungry show me some takeaway food","takeaway_order"
"what places can i order takeout from near by","takeaway_order"
"start a takeaway order for me","takeaway_order"
"order a medium pizza with pepperoni and bacon on its","takeaway_order"
"order chinese for delivery","takeaway_order"
"i want to order some chinese food tonight what's delivering to me","takeaway_order"
"please put in an order from red thai fpr this evening","takeaway_order"
"what is the best pizza near me that delivers","takeaway_order"
"is michael's a takeaway or delivery restaurant","takeaway_query"
"does peking garden deliver","takeaway_query"
"restaurant delivery update","takeaway_query"
"i've cancelled the order placed at mcd did it go through","takeaway_query"
"does arby's do takeaway","takeaway_query"
"does charley's steakhouse deliver","takeaway_query"
"look up whether or not charley's steakhouse delivers","takeaway_query"
"most rated delivery options for chinese food","takeaway_query"
"does restaurant royale deliver takeaway","takeaway_query"
"will the restaurant deliver the order","takeaway_query"
"what are the prices to get to chicago on a train book the cheapest one","transport_query"
"what time does the train arrive in sacremento","transport_query"
"please tell em the list of trains to chicago via california","transport_query"
"give me the list of available train tickets from edinburgh to leeds","transport_query"
"train to athens how to","transport_query"
"i need directions to lowes in mount h nj","transport_query"
"when is the next train leaving for austin","transport_query"
"how to get somewhere","transport_query"
"direct me towards nearest railway station","transport_query"
"search cost for amtrak luxury to los angeles","transport_query"
"find transportation to rome","transport_taxi"
"i need a taxi at eight tomorrow morning to take me to work","transport_taxi"
"look for a taxi to go home","transport_taxi"
"please send a taxi to my house","transport_taxi"
"book a taxi at my home address for right now","transport_taxi"
"what is the number of the closest taxi company","transport_taxi"
"taxi now","transport_taxi"
"book me golden taxi for today at five pm","transport_taxi"
"call me a cab to the train station","transport_taxi"
"get me an uber please","transport_taxi"
"book me a train ticket to atlanta please","transport_ticket"
"ticket for bombay","transport_ticket"
"get me a seat on the next train going to new york","transport_ticket"
"book a train ticket with a berth seat to lucknow for next week","transport_ticket"
"book next ny train ticket","transport_ticket"
"i need a train ticket to rome book ticket","transport_ticket"
"buy me a ticket to boston","transport_ticket"
"book a train ticket for friday april fourteenth for boston","transport_ticket"
"order a train ticket to boston","transport_ticket"
"please book train ticket to new york","transport_ticket"
"traffic please","transport_traffic"
"can i make back home without a traffic jam","transport_traffic"
"are there any roadblocks","transport_traffic"
"is traffic light","transport_traffic"
"how's the traffic","transport_traffic"
"how bad is traffic this morning","transport_traffic"
"what is the traffic today","transport_traffic"
"current traffic conditions","transport_traffic"
"tell me the traffic condition from here to home","transport_traffic"
"what does the traffic look like headed to la","transport_traffic"
"weather forecast please","weather_query"
"should i wear a hat today","weather_query"
"is it sunny in gonbad now","weather_query"
"how's the weather today","weather_query"
"what's the temperature","weather_query"
"what is the weather this friday","weather_query"
"what is today's weather in springfield","weather_query"
"do i need to carry umbrella for evening","weather_query"
"i want the complete weather details of seventh march","weather_query"
"how's weather today","weather_query"
